<?xml version="1.0"?>
<x:books xmlns:x="urn:books" xsi:schemaLocation="urn:books books.xsd" xmlns:xsi="http://www.w3.org/2001/XMLSchema-instance">
   
   <book xsi:type="x:BookForm" id="bk001">
      <author>Writer</author>
      <title>The First Book</title>
      <genre>Fiction</genre>
      <price>44.95</price>
      <pub_date>2000-10-01</pub_date>
      <review>An amazing story of nothing.</review>
   </book>

   <book xsi:type="x:BookForm" id="bk002">
      <author>Poet</author>
      <title>The Poet's First Poem</title>
      <genre>Poem</genre>
      <price>24.95</price>
      <currency>EUR</currency>
      <review>Least poetic poems.</review>
   </book>

   <book xsi:type="x:SimpleBookForm" id="bk003">
      <author>Poet</author>
      <title>The Poet's First Poem</title>
   </book>
</x:books>

